doi,title,abstract,categories,publishedDate,suppItems,assetLink
10.26434/chemrxiv-2025-lj11r,Hybrid Electron-Proton Correlation in Multicomponent Density Functional Theory,"In this contribution we investigate how far multicomponent DFT results can be improved by the admixture of Møller-Plesset perturbation theory electron-proton correlation energies. Three formulations are explored, based off the popular double-hybrid functionals B2PLYP, DSD-PBEP86 and PBEQIDH. Partial use of the PA23 proton binding affinities dataset is made to parameterize the ratio in the DFT:MP2 correlation energies. The resulting models are evaluated on a separate set of titratable molecules. The combination of NEO-DFT and NEO-MP2 electron-proton correlation leads up to a two-fold reduction in the RMSD compared to standard NEO-DFT, a trend that is confirmed in the independent test set. We apply the parameterized NEO-B2PLYP model to compute the energetics of protonated water hexamers as well as a challenging example for proton dynamics, a crown ether molecule. In the latter case we compare the energetics of localized vs shared proton configurations. Overall, a ratio of about 0.8:0.2 (DFT:MP2) in the electron-proton correlation delivers a robust improvement across the models, even with variations in the basis sets used and the type of chemical bonds investigated.",Theoretical and Computational Chemistry; Computational Chemistry and Modeling; Theory - Computational,2025-07-15T13:25:41.297Z,"[{'title': 'Supporting Information', 'assetLink': 'https://chemrxiv.org/engage/api-gateway/chemrxiv/assets/orp/resource/item/6873cc7c728bf9025e432026/original/supporting-information.pdf'}]",https://chemrxiv.org/engage/api-gateway/chemrxiv/assets/orp/resource/item/6873c992fc5f0acb5207f9e0/original/hybrid-electron-proton-correlation-in-multicomponent-density-functional-theory.pdf
10.26434/chemrxiv-2025-ctrrj,Improvement of the Density Fitting Approach for the Gaussian Electrostatic Model via the use of the Discrete Picard Condition in Tychonov Regularization,"The Gaussian Electrostatic Model (GEM) is a density-based force field that employs Hermite Gaussian auxiliary basis sets (ABSs) to represent molec- ular electronic densities for accurate intermolecular interaction calculations. A critical step in GEM involves density fitting via Tychonov regularization, where the choice of the regularization parameter ( λ) has traditionally relied on manual optimization, a tedious and non-systematic process. In this work, we present an automated approach to determine λ by implementing the Dis- crete Picard Condition (DPC), a method designed to stabilize solutions for ill-posed inverse problems. DPC ensures that the decay rate of the solution coefficients aligns with the singular values of the fitting matrix, enabling ro- bust regularization without manual intervention. We validate this method by comparing intermolecular interactions for water dimers and ionic liquid systems against reference quantum mechanical and previously reported data. Results demonstrate that DPC-derived λ values yield interaction energies in close agreement with manually optimized parameters, achieving agreeable er- rors for most ABSs. Notably, DPC eliminates guesswork while maintaining accuracy, as evidenced by its successful integration into the GEM fit soft- ware and the Psi4 quantum chemistry suite. This advancement streamlines the parametrization of polarizable force fields and enhances the reliability of GEM for molecular dynamics simulations.",Theoretical and Computational Chemistry; Computational Chemistry and Modeling; Theory - Computational; Chemoinformatics - Computational Chemistry,2025-07-15T08:46:54.674Z,"[{'title': 'Improvement of the Density Fitting Approach for the Gaussian Electrostatic Model via the use of the Discrete Picard Condition in Tychonov Regularization', 'assetLink': 'https://chemrxiv.org/engage/api-gateway/chemrxiv/assets/orp/resource/item/68715be043bc52e4ec7f9d1e/original/improvement-of-the-density-fitting-approach-for-the-gaussian-electrostatic-model-via-the-use-of-the-discrete-picard-condition-in-tychonov-regularization.pdf'}]",https://chemrxiv.org/engage/api-gateway/chemrxiv/assets/orp/resource/item/68715a49728bf9025e002663/original/improvement-of-the-density-fitting-approach-for-the-gaussian-electrostatic-model-via-the-use-of-the-discrete-picard-condition-in-tychonov-regularization.pdf
10.26434/chemrxiv-2024-54m5x-v3,An Efficient Computational Chemistry Approach to Generating Negative Data for Drug Discovery Pipeline Validation,"Modern virtual high-throughput screening (vHTS) pipelines tend to be overmarketed and undervalidated, with no rigorous studies conclusively demonstrating that every one of their steps reliably adds increasing enrichment atop the baseline random hit rate. Moreover, what little benchmarking studies are available primarily focus on the docking aspect of the pipelines, which is usually only the beginning or near the beginning, and even there, authors tend to use flawed data sets that artificially inflate performance metrics. Herein, we present an alternative method to pipeline validation and data set generation that requires no additional experimental work and expenditure, yet offers negative data that is vastly superior both in terms of quality and quantity to any data set used in vHTS pipeline validation up to now. By randomizing ligands across published experimental structures and generating structural isomers of known binders, practically unlimited amounts of negative data can be generated. Such sets of positive and negative data points match closely in molecular properties and are much more suitable for pipeline validation and have far greater evidentiary value than any of the current sets. Once such sets are generated, they are to be run through any proposed pipeline, assessing performance at every step. We stress the importance of using negative data of adequate quality and quantity in validation studies to definitively and verifiably demonstrate the utility of a given tool or workflow. Our goal is to help distinguish tools and pipelines that truly accelerate hit discovery and lead optimization from ones that promise to do so but actually do not, whereupon academia and industry can begin to tackle the many unaddressed medical needs of the 21st century.",Theoretical and Computational Chemistry; Computational Chemistry and Modeling; Theory - Computational; Chemoinformatics - Computational Chemistry,2025-07-15T07:21:40.922Z,"[{'title': 'Protein – ligand pairs used in the present study.', 'assetLink': 'https://chemrxiv.org/engage/api-gateway/chemrxiv/assets/orp/resource/item/68737a06728bf9025e3ae9ca/original/protein-ligand-pairs-used-in-the-present-study.xlsx'}, {'title': 'Supporting Information', 'assetLink': 'https://chemrxiv.org/engage/api-gateway/chemrxiv/assets/orp/resource/item/68737a80728bf9025e3afe7c/original/supporting-information.pdf'}]",https://chemrxiv.org/engage/api-gateway/chemrxiv/assets/orp/resource/item/68737a05728bf9025e3ae9c2/original/an-efficient-computational-chemistry-approach-to-generating-negative-data-for-drug-discovery-pipeline-validation.pdf
10.26434/chemrxiv-2025-v2jwn,Towards the modeling of static electric field effects in rhodopsin photophysics using QM/MM calculations,"At the atomistic scale, transmembrane voltage can be modeled thanks to the application of an external electric field. We introduce a new QM/MM method in which the QM and MM subsystems interacts with a static electric field (SEF) thanks to ElectroStatic Potential Fitted (ESPF) operators. A simple decomposition of the full (QM/MM, QM/SEF, MM/SEF) interaction energy is proposed. Having validated the method and tested its limitations, it is applied to the case of the Gloeobacter Rhodopsin, a transmembrane photoactive protein with potential applications in optogenetics. We show that its retinal chromophore photo-induced isomerization is barely affected when weak electric fields are applied.",Theoretical and Computational Chemistry; Theory - Computational,2025-07-14T11:29:27.204Z,"[{'title': 'Supplementary Information to ""Towards the modeling of static electric field effects in rhodopsin photophysics using QM/MM calculations""', 'assetLink': 'https://chemrxiv.org/engage/api-gateway/chemrxiv/assets/orp/resource/item/686fb432728bf9025ebdbb04/original/supplementary-information-to-towards-the-modeling-of-static-electric-field-effects-in-rhodopsin-photophysics-using-qm-mm-calculations.pdf'}]",https://chemrxiv.org/engage/api-gateway/chemrxiv/assets/orp/resource/item/686fb226728bf9025ebc720f/original/towards-the-modeling-of-static-electric-field-effects-in-rhodopsin-photophysics-using-qm-mm-calculations.pdf
10.26434/chemrxiv-2025-b2svv,Deterministic quantum mechanics: An easy access to the quantum world,"The application of modern quantum chemical methods to the simulation of chemical reactions makes it obvious that the Copenhagen picture of quantum mechanics cannot be maintained. In ab-initio molecular dynamics methods, any kind of matter is described by applying the Schrödinger equation to the electronic structure and using classical Newton dynamics for the motion of the atomic nuclei. By lots of calculations on this basis, it has become obvious that this concept is superior to a quantum chemical description of nuclear motion. The nuclei move according to Newton's laws in a perfectly local and deterministic way while the surrounding electronic cloud determines bonding and antibonding interactions between the atoms. The resulting theory is a deterministic formulation of quantum mechanics which is free from paradoxa and is able to explain complex phenomena like photochemistry. An obvious consequence is that molecules like ammonia can have a permanent dipole moment in spectroscopic measurements, while consistent application of traditional quantum mechanics predicts a higher symmetry as is outlined in the paper.",Theoretical and Computational Chemistry; Theory - Computational,2025-07-14T11:16:13.488Z,[],https://chemrxiv.org/engage/api-gateway/chemrxiv/assets/orp/resource/item/686fa7fe728bf9025eb822f3/original/deterministic-quantum-mechanics-an-easy-access-to-the-quantum-world.pdf
10.26434/chemrxiv-2025-vtwpr-v2,Sub-Nanometer Confinement Suppresses Autoionization of Water,"Water confined within nanometer-scale environments plays a central role in functional materials for nanofluidic and membrane-based applications, where acid–base equilibria and proton transport govern essential processes such as ion conduction, energy conversion, and chemical separations. Similar mechanisms are also fundamental to biological systems, including enzyme catalysis and cellular signaling. At sub-nanometer scales, confinement and interfacial interactions dramatically reshape the molecular landscape, challenging conventional assumptions about pH and chemical reactivity. Here, we combine density-corrected density functional theory with machine-learned interatomic potentials to investigate the autoionization of water confined to quasi-two-dimensional monolayers within sub-nanometer slit pores. We find that extreme confinement markedly suppresses water autoionization, raising the effective pKw by more than two units. This suppression originates from hydroxide ion destabilization at interfaces, driven by restricted hydrogen bonding, hindered molecular reorientation, and a breakdown of Grotthuss proton transport caused by topological frustration in the hydrogen-bond network. These findings offer a molecular-level understanding of how confinement modulates fundamental aqueous chemistry and establish guiding principles for tuning pH-dependent reactivity in nanoscale environments.",Theoretical and Computational Chemistry; Physical Chemistry; Materials Science; Computational Chemistry and Modeling; Theory - Computational; Machine Learning,2025-07-14T07:27:00.040Z,"[{'title': 'Supporting Information', 'assetLink': 'https://chemrxiv.org/engage/api-gateway/chemrxiv/assets/orp/resource/item/68700142e1957b8c613c6e17/original/supporting-information.pdf'}]",https://chemrxiv.org/engage/api-gateway/chemrxiv/assets/orp/resource/item/68700142e1957b8c613c6e0d/original/sub-nanometer-confinement-suppresses-autoionization-of-water.pdf
10.26434/chemrxiv-2024-zk6hp-v3,Real-space machine learning of correlation density functionals,"Machine learning (ML) plays a pivotal role in extending the reach of quantum chemistry methods for both molecules and materials.  However, leveraging ML to improve upon human-designed density functional approximations (DFAs), the primary workhorse for quantum simulations,  remains challenging due to severely limited transferability to unseen chemical systems.  Here we address this challenge through real-space ML, where energies are learned point by point via correlation energy densities per particle obtained from regularized perturbation theory.  We pursue two crucial strategies that enable the construction of highly transferable DFAs, grounded in the Møller–Plesset adiabatic connection framework, for correlation energies defined with respect to the Hartree–Fock reference. First, we introduce the Local Energy Loss, whose data efficiency (expanding each system’s single energy into thousands of datapoints) dramatically enhances transferability when combined with a physically informed ML construction. Second, we construct a real-space, machine-learned, and regularized extension of Spin-Component-Scaled second-order Møller–Plesset perturbation theory, opening new avenues for developing transferable DFAs particularly suited for overcoming self-interaction errors common to traditional DFAs.",Theoretical and Computational Chemistry; Computational Chemistry and Modeling; Theory - Computational; Machine Learning,2025-07-14T06:54:33.866Z,[],https://chemrxiv.org/engage/api-gateway/chemrxiv/assets/orp/resource/item/686eb446728bf9025e97c8ad/original/real-space-machine-learning-of-correlation-density-functionals.pdf
