doi,title,abstract,categories,publishedDate,suppItems,assetLink
10.26434/chemrxiv-2025-ggp8n-v4,How to build machine learning models able to extrapolate from standard to modified peptides,"Bioactive peptides are an important class of natural products with great functional versatility. Chemical modifications can improve their pharmacology, yet their structural diversity presents unique challenges for computational modeling. Furthermore, data for standard peptides (composed of the 20 canonical amino acids) is more abundant than for modified ones. Thus, we set out to identify whether predictive models fitted to standard data are reliable when applied to modified peptides. To do this, we first considered two critical aspects of the modeling problem, namely, choice of similarity function for guiding dataset partitioning and choice of molecular representation. Similarity-based dataset partitioning is an evaluation technique that divides the dataset into train and test subsets, such that the molecules in the test set are different from those used to fit the model.  

Scientific contribution. We demonstrate, across four peptide function prediction tasks, that chemical fingerprint-based similarity measures outperform traditional sequence alignment-based metrics for partitioning standard peptide datasets, challenging conventional practice. We have also found that the choice of representation does not have a substantial impact in the standard to standard interpolation modelling scenario, but for modified to modified interpolation chemical language models are the best option. Despite a 50\% drop in performance, chemical fingerprints and a chemical language model (ChemBERTa-2) are the best choices in the more challenging extrapolation scenario (standard to modified). All code and data necessary for reproducing the experiments are available in Github (https://github.com/IBM/PeptideGeneralizationBenchmarks).",Theoretical and Computational Chemistry; Biological and Medicinal Chemistry; Bioinformatics and Computational Biology; Machine Learning; Chemoinformatics - Computational Chemistry,2025-10-23T09:17:41.471Z,[],https://chemrxiv.org/engage/api-gateway/chemrxiv/assets/orp/resource/item/68f749043e6156d3be1c29e5/original/how-to-build-machine-learning-models-able-to-extrapolate-from-standard-to-modified-peptides.pdf
10.26434/chemrxiv-2025-bg1t9,FEP Ω: The End of Parameter Tuning,"Free energy perturbation (FEP) is the gold standard in structure-based drug design, but its lack of out-of- the-box accuracy requires extensive parameter tuning, often delaying its use in compound design. To address this, we present FEP Ω, a novel ML-native platform for FEP that directly resolves these limitations and accelerates deployment. FEP Ω flips the traditional paradigm of free energy perturbation on its head by eliminating a priori force field adjustments, alchemical intermediates, and network corrections. Instead, FEP Ω uses a standardized and automated setup protocol while leveraging machine learning post-simulation to achieve unprecedented, data-driven accuracy in a streamlined workflow. Together, these innovations make FEP lighter, faster, more accurate, and immediately practical for hit-to-lead and lead optimization. Finally, benchmarking against Schrödinger’s FEP-PB demonstrates superior accuracy in a fraction of the time, removing longstanding barriers to FEP adoption in drug discovery.",Theoretical and Computational Chemistry; Biological and Medicinal Chemistry; Drug Discovery and Drug Delivery Systems; Computational Chemistry and Modeling; Machine Learning,2025-10-23T05:37:15.627Z,[],https://chemrxiv.org/engage/api-gateway/chemrxiv/assets/orp/resource/item/68f6a2f13e6156d3be075dc5/original/fep-the-end-of-parameter-tuning.pdf
10.26434/chemrxiv-2025-xn5zb-v3,DeepFit: physically and chemically informed XAS-Structure fitting made simple,"Whilst X-ray Absorption Near Edge Structure (XANES) spectroscopy is a valuable tool to unravel local atomic and electronic structure of catalysts' active sites under working conditions, its quantitative analysis is a complex ill-posed problem. Main limitations of currently existing methods for XANES quantitative analysis are (1) high demand of computational resources needed, (2) lack of universality of ML models between absorption edges, (3) absence of chemical and physical constraints, (4) low specificity for real catalytical cases. To address them simultaniously in an unified framework we introduce the DeepFit, a deep learning approach for physically and chemically informed on-the-fly XANES spectra analysis. By constructing the tmXAS—a comprehensive database of 67,000 possible local atomic environments and their corresponding Ab-initio K-edge XAS spectra for all 3d and 4d transition metals—we leverage a state-of-the-art universal deep learning model for rapid spectral prediction. This approach incorporates physical constraints through equivariance, ensuring consistency with fundamental symmetries. Then, combining quantum chemistry and DeepFit neural network differentiation, we implement an approach for chemically informed atomic structure refinement, capable of $3D$ structure prediction considering both spectroscopic and energetic favorability. Domain-specific spectroscopic solutions were put in the tmXAS database and DeepFit approach to better work with often overlooked in analysis methods and highly relevant cases of homogeneous and single-site/single-atom catalysts. The method's validity for both structure refinement and spectra prediction is rigorously demonstrated with several benchmarks, including structure unraveling of the Rh-complex homogeneous hydroformylation catalyst and well-defined 3d/4d metal coordination compounds (Cu, Co, Zn, Ni), where quantitative agreement with single-crystal XRD and EXAFS is met. By unifying physical constraints with computational efficiency, DeepFit establishes a new universal method for rapid XANES analysis with chemical plausibility and spectroscopic agreement being systematically encoded into efficient gradient-driven optimization.",Theoretical and Computational Chemistry; Physical Chemistry; Machine Learning; Spectroscopy (Physical Chem.),2025-10-22T09:11:10.941Z,[],https://chemrxiv.org/engage/api-gateway/chemrxiv/assets/orp/resource/item/68f5ea77aec32c65680dc9db/original/deep-fit-physically-and-chemically-informed-xas-structure-fitting-made-simple.pdf
10.26434/chemrxiv-2025-18pps,Accurate Adsorption Energies of C-Species on Copper Catalysts,"Accurate prediction of adsorption energies for C-species on copper catalysts is critical for understanding catalytic behavior and catalyst design. However, conventional density functional theory often falls short, as exemplified by the “CO adsorption puzzle.” Here, we demonstrate that the hybrid PBE-D3/M06 method overcomes these limitations, achieving near-chemical accuracy for C-species on Cu(100), Cu(110), and Cu(111) surfaces. This approach resolves the CO puzzle by correctly predicting adsorption sites and energies in excellent agreement with experimental data. The method yields remarkably low mean absolute errors (MAEs) of 0.06 eV for reaction intermediates (vs. RPA calculations) and 0.04 eV for molecules (vs. experimental values). To accelerate these high-fidelity calculations, we further developed a machine learning model that rapidly predicts accurate adsorption energies (MAE: 0.08 eV) from standard PBE values. When applied to electrochemical CO2-to-CO conversion, our approach predicts onset and equilibrium potentials to within 0.04 V of experimental measurements across all low-index copper facets. This combined computational strategy provides an efficient and reliable framework for the rational design of copper-based catalysts.",Theoretical and Computational Chemistry; Catalysis; Computational Chemistry and Modeling; Machine Learning; Electrocatalysis,2025-10-21T13:00:53.210Z,"[{'title': 'Supplementary Materials', 'assetLink': 'https://chemrxiv.org/engage/api-gateway/chemrxiv/assets/orp/resource/item/68f391c43e6156d3beb3144e/original/supplementary-materials.pdf'}]",https://chemrxiv.org/engage/api-gateway/chemrxiv/assets/orp/resource/item/68f38f5a5dd091524f30056c/original/accurate-adsorption-energies-of-c-species-on-copper-catalysts.pdf
10.26434/chemrxiv-2025-jb2f5-v2,Multi-Solvent Graph Neural Network for Reduction Potential Prediction across the Chemical Space,"Reduction potentials of redox-active molecules and materials are essential descriptors of their performance as catalysts, antioxidants, electrode materials, etc. For a given species, its practical applications often span a range of solvent environments, which profoundly impact its redox properties. In this work, we present a message passing graph neural network architecture with a set transformer readout trained on ca. 20,000 reduction potentials of chemically diverse closed- and open-shell organic redox-active molecules (the “ReSolved” dataset), computed using a rigorously benchmarked density functional theory procedure. The predictor model affords high accuracy with mean absolute errors of ca. 0.2 eV and is uniquely able to generalise to previously unseen solvents. We couple this architecture with an evolutionary algorithm to inverse-design synthetically accessible candidate molecules with target reduction potentials for several battery-related practical applications.",Theoretical and Computational Chemistry; Physical Chemistry; Organic Chemistry; Physical Organic Chemistry; Computational Chemistry and Modeling; Machine Learning,2025-10-21T09:05:00.210Z,"[{'title': 'Supporting Information', 'assetLink': 'https://chemrxiv.org/engage/api-gateway/chemrxiv/assets/orp/resource/item/68f2619f5dd091524f0de4c6/original/supporting-information.pdf'}]",https://chemrxiv.org/engage/api-gateway/chemrxiv/assets/orp/resource/item/68f2619f5dd091524f0de4af/original/multi-solvent-graph-neural-network-for-reduction-potential-prediction-across-the-chemical-space.pdf
